file_name,uni,wylie,url,dept,grade,char_len,audio_len,path,inf
STT_NS0025_0178_1373346_to_1380400,ཞོགས་པ་སྔ་བོ། འུན་འུན། ཁ་ཤས་ལ་ཁོང་ཚོས་སྐད་ཆེན་པོ་བརྒྱབ་ནས་ཀློག་གི་རེད་དངོས་གནས། འུན་འུན། དེ་དུས་དངོས་གནས་ད་ཞོགས་པ་སྔ་བོ་ནས་ལང་དགོས་རེད་ད་ཡ། ལང་ནས་ཚང་མ་སོ་སོ་ ,zhogs pa snga bo/_'un 'un/_kha shas la khong tshos skad chen po brgyab nas klog gi red dngos gnas/_'un 'un/_de dus dngos gnas da zhogs pa snga bo nas lang dgos red da ya/_lang nas tshang ma so so _,https://d38pmlk0v88drf.cloudfront.net/wav16k/STT_NS0025_0178_1373346_to_1380400.wav,STT_NS,3,158,7.054,wav16k/STT_NS0025_0178_1373346_to_1380400.wav,ཞོགས་པ་སྔ་པོ་ཁ་ཤས་། ཁོ་ཚོ་སྐད་ཆེན་པོ་བརྒྱབ་ནས་ཀློག་གི་རེད། དངོས་གནས། དེ་དུས་དངོས་གནས་ད་ཞོགས་པ་སྔ་བོ་ནས་ལངས་དགོས་རེད་ད་ཡད། ལངས་ ཚང་མ་སོ་སོ།
STT_NS0025_0179_1380923_to_1385699,དེ་དུས་ད་དཔེ་ད་ང་ཚོ་བི་མོ་སྡོད་ཁང་ལ་དཔེ་གཙང་སྦྲ་བྱེད་གི་རེད། འུན་འུན། ཨ་ཧང་སང་ཡ་རེད།  ,de dus da dpe da nga tsho bi mo sdod khang la dpe gtsang sbra byed gi red/_'un 'un/_a hang sang ya red/__,https://d38pmlk0v88drf.cloudfront.net/wav16k/STT_NS0025_0179_1380923_to_1385699.wav,STT_NS,3,86,4.776,wav16k/STT_NS0025_0179_1380923_to_1385699.wav,དེ་དུས་ད་དཔེ་ད་ང་ཚོ་བུ་མོའི་སྡོད་ཁང་ལ་དཔེ་གཙང་སྦྲ་བྱེད་ཀི་རེད། ཨ། ཧང་སང་ཡོད་རེད།
STT_NS0025_0180_1386407_to_1390930,ཉི་མ་གཟའ་ཉི་མ་རྟག་པར་འདི་བྱེད་གི་རེད་ཡང་ལཱ་ཕུར། འུན་ཧོང་། རྡོག་ཕྱིས་བརྒྱབ་དགོས་རེད། འ་ཧོང་། ཨ་མ།  ,nyi ma gza' nyi ma rtag par 'di byed gi red yang lA phur/_'un hong /_rdog phyis brgyab dgos red/_'a hong /_a ma/__,https://d38pmlk0v88drf.cloudfront.net/wav16k/STT_NS0025_0180_1386407_to_1390930.wav,STT_NS,3,98,4.523,wav16k/STT_NS0025_0180_1386407_to_1390930.wav,ཉི་མ་གཟའ་ཉི་མ་རྟག་པར་དེ་བྱེད་ཀི་རེད། ཡང་ལ་པུར་ྡོག་ཅས་རྒྱབ་རེད། ཨ་ཧ།།
STT_NS0025_0181_1391402_to_1395705,དངོས་གནས་སྐྱིད་རེད་ད། མཚམས་མཚམས་འདྲེད་དག་ཁོ་རང་ཤོར་གྲབས་བྱེད་གི་རེད་དེ། མར་ལྟ་ར་མཐོང་གི་རེད་གདོང་པ་ འུན་འུན།  ,dngos gnas skyid red da/_mtshams mtshams 'dred dag kho rang shor grabs byed gi red de/_mar lta ra mthong gi red gdong pa _'un 'un/__,https://d38pmlk0v88drf.cloudfront.net/wav16k/STT_NS0025_0181_1391402_to_1395705.wav,STT_NS,3,110,4.303,wav16k/STT_NS0025_0181_1391402_to_1395705.wav,དངོས་གནས་ཁྱོད་ མཚམས་མཚམས་གྲོ་མདོག་ཁ་རང་ཤོར་བྲོ་བྱེད་ཀི་རེད་ད། མར་ལྟ་རེ། མཐོང་གི་རེད་གདོང་པ། ཚང་མ་ཡོད་རེད།
STT_NS0025_0182_1396431_to_1402793,ཨ་ལྷམ་ཀོག་ཚང་མ་པུད་ནས་འགྲོ་དགོས་རེད། འུན་འུན་། ཡར་ནང་ལོགས་ལ། ད་ང་ཚོ། ང་རྐང་རྗེན་མ་འགྲོ་ཡ་དགའ་བོ་མེད་བ། ནང་ལོག ལ་ལྷམ་ཀོག་གོན་ཆོག་གི་མ་རེད། རྐང་རྗེན་མ་འགྲོ་དགོས་རཱ།  ,a lham kog tshang ma pud nas 'gro dgos red/_'un 'un /_yar nang logs la/_da nga tsho/_nga rkang rjen ma 'gro ya dga' bo med ba/_nang log_la lham kog gon chog gi ma red/_rkang rjen ma 'gro dgos rA/__,https://d38pmlk0v88drf.cloudfront.net/wav16k/STT_NS0025_0182_1396431_to_1402793.wav,STT_NS,3,164,6.362,wav16k/STT_NS0025_0182_1396431_to_1402793.wav,ཨ་ལྷམ་གོག་ཚང་མ་ཕུད་ནས་འགྲོ་གོ་རེད། ཡ་། ནང་ལོགས་ལ་ད་ང་ཚོ་ང་རྐང་རྗེ་མ་འགྲོ་ཡ་དགའ་བོ་མེད་བ། ད་ནང་ལོགས་ལ་ལྷམ་གོག་གལ་ཆོག་གི་མ་རེད། རྐང་རྗེ་མ་འགྲོ་གི་རེད་བ།
STT_NS0053_0224_1751017_to_1760847,ད་ཨེ་འདྲ་བརྒྱབ་ནས་རཱ། ཕར་དེ་ལ་ཉལ་ཁང་ཏོག་ཙི། ཉལ་ཁང་ཏོག་ཙི་བསྡད་སྡད་ཡིན་པ། ཨེ་ནས་དཔེ་ཚབ་སོང་ཨ། ད་ཡིས་གེ་སྒང་ལ་ཅ་ལག། ཅ་ལག་དེ་ཚོ་བརླག་ཡོད་ཀྱིས་བསམ་ནས།  ,da e 'dra brgyab nas rA/_phar de la nyal khang tog tsi/_nyal khang tog tsi bsdad sdad yin pa/_e nas dpe tshab song a/_da yis ge sgang la ca lag/_ca lag de tsho brlag yod kyis bsam nas/__,https://d38pmlk0v88drf.cloudfront.net/wav16k/STT_NS0053_0224_1751017_to_1760847.wav,STT_NS,3,148,9.83,wav16k/STT_NS0053_0224_1751017_to_1760847.wav,ཨེ་འདྲའི་བརྒྱབ་ནས་ཡརཕར་ཚ་ཉལ་ཁང་གཅིག་ཙི་དམ་།ཉལ་ཁང་ཏིག་ཙི་བསྡད་བསྡད་ཡིན་པ། ཨ་ལེ། ཨེ་ནས་དཔེ་ཚབ་སོང་ཡད་བ། ད་ཡ་གེ་སྒང་ལ་ཅ་ལག་ཅ་ལག་དེ་ཚོ་གནས་ཡོད་ཀྱི་རེད་བསམ་ནས།
STT_NS0025_0183_1406877_to_1411382,ཞལ་ལ་གང་ལ་འགྲོ་ན་ན་གི་འདུག་བ། འོ་དེ་འདྲའི་ན་གི ང་དཔེ་ཉོབ་གི་ཡོད་རཱ་དེའི། ཨ་ལེ་ ,zhal la gang la 'gro na na gi 'dug ba/_'o de 'dra'i na gi_nga dpe nyob gi yod rA de'i/_a le _,https://d38pmlk0v88drf.cloudfront.net/wav16k/STT_NS0025_0183_1406877_to_1411382.wav,STT_NS,3,79,4.505,wav16k/STT_NS0025_0183_1406877_to_1411382.wav,ཞལ་ལ་ྒང་ལ་འགྲོ་ན་ན་ཡི་འདུག་བ། འོ་དེ་འདྲའི་ན་གི་ཡོད། ང་དཕེ་ཉོབ་ཀི་ཡོད་རེད། ཨ་ལེ་ཅ
STT_NS0025_0184_1411770_to_1418655,དངོས་གནས་ཧང་ས་ཡ། དེ་དུས་ད་དཔེ་སྒྲིག་འཛུགས་དམ་པོ་ཡོད་རེད། འུན་འུན། ཕྱོགས་གཅིག་ནས་ད་དངོས་གནས་ཡག་པོ་རེད། གཙང་མ་གཙང་མ་བྱེད། ཕྱོགས་གཅིག་ནས་ཡང་དཔེ་དམ་པོ་ཡོད་རེད་ད། འུན་འུན། གཙང་སྦྲ་དང་བྱེད་དུས་ཙམ་པ།  ,dngos gnas hang sa ya/_de dus da dpe sgrig 'dzugs dam po yod red/_'un 'un/_phyogs gcig nas da dngos gnas yag po red/_gtsang ma gtsang ma byed/_phyogs gcig nas yang dpe dam po yod red da/_'un 'un/_gtsang sbra dang byed dus tsam pa/__,https://d38pmlk0v88drf.cloudfront.net/wav16k/STT_NS0025_0184_1411770_to_1418655.wav,STT_NS,3,194,6.885,wav16k/STT_NS0025_0184_1411770_to_1418655.wav,དངོས་ནེ་ཧང་སང་དེ་དུས་ད་དཔེ་སྒྲིག་འཛུགས་དོན་པོ་ཡོད་རེད་ དཕྱོགས་གཅིག་ནས་ད་དངོས་གནས་ཡག་པོ་རེད། གཙང་མ་བྱས། ཕྱོགས་གཅིག་ནས་ཡང་དཔེ་དོན་པོ་ཡོད་རེད་ད་རེད། གཙང་སྦྲ་དུ་བྱེད་དུས་ཙམ་པ།
STT_NS0025_0185_1422064_to_1431199,ད་ཡར་མར་མཆོང་ན་མི་འདུག་བེ། ཉེས་པ་རག་གི་རེད། དེ་ཞེ་བོ་གཅིག་ཞིབ་ཚགས་བྱེད་གི་རེད། ཨ་མ་སྐབས་དེ་དུས་ཙམ་པ། རེད་རེད། དངོས་གནས་རེད། སྔོན་མ་ད་ལྟ་ང་ཚོ་ཁམས་ཚན་ཁམས་ཚན་གིས་ ,da yar mar mchong na mi 'dug be/_nyes pa rag gi red/_de zhe bo gcig zhib tshags byed gi red/_a ma skabs de dus tsam pa/_red red/_dngos gnas red/_sngon ma da lta nga tsho khams tshan khams tshan gis _,https://d38pmlk0v88drf.cloudfront.net/wav16k/STT_NS0025_0185_1422064_to_1431199.wav,STT_NS,3,160,9.135,wav16k/STT_NS0025_0185_1422064_to_1431199.wav,ཨུད་ཡར་ཨ་མ་གྱོང་ནས་མི་འདུག ཉེས་པ་རག་གི་རེད། དཔེ་ཞེ་བོ་ཞིབ་ཚག་བྱེད་གོ་རེད། ་མསྐབས་དེ་དུས་ཙམ་པ། རེད་རེདད།་དངོས་གནས་རེད། ་པོ་ཡོད་རེད སྔོན་མ་ད་ལྟ་ང་ཚོ་་ཁང་ཚན་ཁངས་ཚན་གི་
STT_NS0025_0186_1431199_to_1440334,འདི་གཙང་སྦྲ་ཞེ་བོ་སྤྲད་ཡས་འདྲ་བོ་སྲོལ་ཡོད་བ་དམིགས་བསལ་གྱི་ཁྱོད་ཚོ་དབྱངས་ཆེན་རྒྱལ་ཡིན་ན་ཁམས་ཚན་ཁམས་ཚན་སྤྲད་གོ་མ་རེད་རཱ། ང་ཚོ་ཁམས་ཚན་ཁམས་ཚན་མ་རེད་ང་ཚོ་ཉལ་ཁང་ཉལ་ཁང་རེད། ཉལ་སྤྲད་གོ་རཱ་འོ།  ,'di gtsang sbra zhe bo sprad yas 'dra bo srol yod ba dmigs bsal gyi khyod tsho dbyangs chen rgyal yin na khams tshan khams tshan sprad go ma red rA/_nga tsho khams tshan khams tshan ma red nga tsho nyal khang nyal khang red/_nyal sprad go rA 'o/__,https://d38pmlk0v88drf.cloudfront.net/wav16k/STT_NS0025_0186_1431199_to_1440334.wav,STT_NS,3,185,9.135,wav16k/STT_NS0025_0186_1431199_to_1440334.wav,གཙང་སྦྲ་ཞེ་བོ་སྤྲད་འདྲ་བོ་བཟོ་གི་ཡོད་བ།  དམིགས་བསལ་གིཁྱེད་ཚོ་དབྱངས་ཅན་རྒན་ལགས་ཡིན་ན་ཁང་ཚན་ཁང་ཚན་སྤྲད་ཀི་ཡོད་མ་རེད་ར ཁང་ཚ་ཁང་ཚན་ཁང་ཚན་ེ། སོད་ང་སྡོད་ཁང་ཕྱི་དང་ཉལ་ཁང་ཉལ་ག་སྤྲད་གོ་རེད།ཨ།
STT_NS0025_0187_1440334_to_1449469,ང་ཚོ་སྡོང་ཁང་ང་སམ་བྷོ་ཊ་ལ་བསྡད་མྱོང་ཡོད་དེ་ནས་ཨ་གླུའི་རྒྱལ་མཚན་ལ་བསྡད་མྱོང་ཡོད། དེ་ནས་ང་ལྷ་དབང་རྒྱལ་ལ་བསྡད་མྱོད་ཡོད། ལྷ་དབང་རྒྱལ་དང་སྔོན་མ་ང་འཛིན་གྲྭ་ ,nga tsho sdong khang nga sam b+ho Ta la bsdad myong yod de nas a glu'i rgyal mtshan la bsdad myong yod/_de nas nga lha dbang rgyal la bsdad myod yod/_lha dbang rgyal dang sngon ma nga 'dzin grwa _,https://d38pmlk0v88drf.cloudfront.net/wav16k/STT_NS0025_0187_1440334_to_1449469.wav,STT_NS,3,151,9.135,wav16k/STT_NS0025_0187_1440334_to_1449469.wav,ང་ཚོ་སྡོད་ཁང་ང་སམ་བྷོ་ཊ་ལ་བསྡད་མྱོང་ཡོད། དེ་ནས་ཀླུས་རྒྱལ་ཆན་ལ་བསྡད་མྱོང་ཡོད། དེ་ནས་ང་ལྷ་དབང་རྒྱན་ལ་བསྡད་མྱོང་ཡོད། ལྷ་དབང་རྒྱལ་དང་སྔོན་མ་ང་འཛིན་གྲྭ་
STT_NS0025_0138_1063881_to_1071689,སྤུ་གུ་བཅུ་སེ་ཡོད་ཀྱི་རེད་ ཚང་མ་པུས་མོ་བཙུགས་ནས་བཞག་སོ་གདའ་ ཐ་ཧང་སང་ཡས་ངོ་ཚ་སོང་ང་ཚོ་དང་ ག་བྱེད་ནས་དེ་དུས་པུས་མོ་བཙུགས་ནས་བཞག་ཚར་བ་དང་ཏག་ཏག་བར་སེང་ཟིན་སོང་ ,spu gu bcu se yod kyi red _tshang ma pus mo btsugs nas bzhag so gda' _tha hang sang yas ngo tsha song nga tsho dang _ga byed nas de dus pus mo btsugs nas bzhag tshar ba dang tag tag bar seng zin song _,https://d38pmlk0v88drf.cloudfront.net/wav16k/STT_NS0025_0138_1063881_to_1071689.wav,STT_NS,3,156,7.808,wav16k/STT_NS0025_0138_1063881_to_1071689.wav,ཆུག་སི་ཡོད་རྒྱི་རེད། ཚང་མ་པུས་མོ་བཙུགས་ནས་བཞག་སོང་ད། ད་ཧང་སང་ཡ་ངོ་ཚ་སོང་། ང་ཚོ་ད་ ག་རེ་བྱས་ དེ་དུས་པུས་མོ་བཙུགས་ནས་བཞག་ཚར་བ་དང་ཏག་ཏག་དེ་བར་གསེང་ཟིན་སོང་།
STT_NS0025_0139_1071959_to_1080821,བར་སེང་ཟིན་སོང་། དེ་ནས་འཛིན་གྲྭ་སྤུ་གུ་ཚང་མ་པུས་མོ་བཙུགས་བསྡད་ཡོད་རེད་ ད་མི་ཚང་མ་ལྟ་བསྡད་ན་འཚེར་བོ་དཔེ་འདུག་བ་ད། དེ་དུས་ང་ཚོ་ཡིན་ན་དབྱིངས་ག་རེ་ཡོད་རེད་ལབ་ན་ བཅུ་གཅིག་བཅུ་གཉིས་དེ་དུས་འཛིན་གྲྭ་ང་ཚོ་མདུན།  ,bar seng zin song /_de nas 'dzin grwa spu gu tshang ma pus mo btsugs bsdad yod red _da mi tshang ma lta bsdad na 'tsher bo dpe 'dug ba da/_de dus nga tsho yin na dbyings ga re yod red lab na _bcu gcig bcu gnyis de dus 'dzin grwa nga tsho mdun/__,https://d38pmlk0v88drf.cloudfront.net/wav16k/STT_NS0025_0139_1071959_to_1080821.wav,STT_NS,3,203,8.862,wav16k/STT_NS0025_0139_1071959_to_1080821.wav,ཧཧ་ཧ་ཧ། བར་གསེང་ཟིན་སོང་། ད་དུ་འཛིན་གྲྭ་པུ་གུ་ཚང་མ་པུས་མོ་བཙུགས་བསྡད་ཡོད། ད་མི་ཚང་མ་ལྟ་བསྡད་ན་འཚེར་པོ་དཔེ་འདུག་བ་ད། ར། ད་དེ་དུས་ང་ཚོ་ཡིན་ན་དབྱིངས་ག་རེ་ཡོད་རེད་ལབ་ན། བཅུ་གཅིག་བཅུ་གཉིས་དེ་དུས་འཛིན་གྲྭ་ང་ཚོ་བདུན་
STT_NS0025_0140_1080821_to_1089684,འཛིན་གྲྭ་བདུན་པ་སྐབས་སུ། བཅུ་གཅིག་ཐེངས་མ་དང་པོ་སུ་ཇཱ་ལ་ཐེངས་མ་དང་པོ་སླེབས་དུས་རེད། ཐ་ཕྱི་ལོག་ནས་མི་སླེབས་འདུག་ལབ་ན་ ང་ཚོ་འཛིན་གྲྭ་སྤུ་གུ་དེ་ཚོ་ཡིན་ན་སློབ་སྦྱོང་ལ་དོ་སྣང་མེད། གཅིག་ཡོ་བ་ད། ག་རེ་ལབ་དགོས་རེད། བུ་དང་བུ་མོ ,'dzin grwa bdun pa skabs su/_bcu gcig thengs ma dang po su jA la thengs ma dang po slebs dus red/_tha phyi log nas mi slebs 'dug lab na _nga tsho 'dzin grwa spu gu de tsho yin na slob sbyong la do snang med/_gcig yo ba da/_ga re lab dgos red/_bu dang bu mo_,https://d38pmlk0v88drf.cloudfront.net/wav16k/STT_NS0025_0140_1080821_to_1089684.wav,STT_NS,3,217,8.863,wav16k/STT_NS0025_0140_1080821_to_1089684.wav,བདུན་པ་སྐབས་སུ་བཅུ་གཅིག ཐེངས་མ་དང་པོ་སུ་ཇཱ་ལ་ཐེངས་མ་དང་པོ་སླེབས་བསྡད་ཡོད་རེད། ད་ཕྱི་ལོགས་ནས་མི་སླེབས་འདུག་ལབ་ན། ང་ཚོ་འཛིན་གྲྭ་བུ་གུ་དེ་ཚོ་ཡིན་ན་སློབ་སྦྱོང་ལ་དོ་སྣང་མེད། ཅིག་ཡོད་བ་ད་ཨག་རེ་ལབ་དགོས་རེད། བུ་ད་
STT_NS0025_0141_1089684_to_1098547,བོུ་ཚང་མ་ལ་ ཐ་ཡར་ཀྲུང་བསྡད་ངེ་དེ་འདྲས་ཡོད་བ་ གང་ལ་ཡོད་དུས་ ང་ཚོ་འཛིན་གྲྭ་ནང་ལ་ཡོད་རེད་ད་དུང་དེ་བ་ལ་བོུ་དེ་འདྲ་ཡོད་རེད་ ཁྱོད་ཧ་གོ་ཀི་ཡོད་ཀྱི་རེད་ཨ་མ་པི་ཇི་ ,bo+u tshang ma la _tha yar krung bsdad nge de 'dras yod ba _gang la yod dus _nga tsho 'dzin grwa nang la yod red da dung de ba la bo+u de 'dra yod red _khyod ha go ki yod kyi red a ma pi ji _,https://d38pmlk0v88drf.cloudfront.net/wav16k/STT_NS0025_0141_1089684_to_1098547.wav,STT_NS,3,155,8.863,wav16k/STT_NS0025_0141_1089684_to_1098547.wav,བུ་མོ་ཚང་མ་ལ་ད་ཅིག་ཡར་སྲུང་བསྡད་མྱི་དེ་འདྲའི་ཡོད་བ། སྒང་ལ་ཡ་དེ་ུང་ཚོའི་འཛིན་གྲྭ་ནང་ལ་ཡོད་རེད་ད་ད་ལྟང་དེ་བ་ལ་བུ་མོ་དེ་འདྲའི་ཡོད་རེད་ ཁྱོད་ཧ་གོ་ི་ཡོད་ྒྱི་རེད། ཡོད་རེདད་བཅུ་གཅིག་ཨ་མ་ཕིག་ཅུ
STT_NS0025_0142_1098547_to_1107410,ཅོ་ཅོ་འདིའི་ངར་ལྟ་སོང་ང་ངོ་ཚ་གི་འདུག་འདྲ་བོ་ཡོད་བ་ ད་ཡིན་ཡ་ས་སྙིང་རྗེ་སོ་སོ་ཡར་སྣང་བ་འདྲ་བོ་འགྲོ ཐེངས་མ་དང་པོ་ཕྱིས་ལོག་ནས་སླེབས་ཀི་ཡོད་ར་ཐ་ཁོང་ཚོ་མཐོང་དུས་སྐབས་སུ་ངོ་འདྲ་བོ་ཚ་རཱ།  ,co co 'di'i ngar lta song nga ngo tsha gi 'dug 'dra bo yod ba _da yin ya sa snying rje so so yar snang ba 'dra bo 'gro_thengs ma dang po phyis log nas slebs ki yod ra tha khong tsho mthong dus skabs su ngo 'dra bo tsha rA/__,https://d38pmlk0v88drf.cloudfront.net/wav16k/STT_NS0025_0142_1098547_to_1107410.wav,STT_NS,3,180,8.863,wav16k/STT_NS0025_0142_1098547_to_1107410.wav,ཇོ་ཇོ་དེ་ང་ལྟ་སེང་ང་ངོ་ཚ་གི་འདུག་འདྲ་བོ་ཡོད་བ། དཡིན་ཡ་སྙིང་རྗེ་སོ་སོ་ཡར་སྣང་བ་འདྲ་བོ་འགྲོ། ཐེངས་མ་དང་པོ་ཕྱི་ལོགས་ནས་སླེབས་རྒྱོ་ཡོད་རེད་། ཨེ་ནས་སྣང་བ་འདྲ་བོ་འགྲོ་རེད་། ད་ཁོ་ཚོས་མཐོང་དུས་སྐབས་སུ་ངོ་འདྲ་བོ་ཚ་རེད་བ་ད།
STT_NS0025_0143_1107410_to_1116272,ཐ་ཨེ་འདྲེ་བྱེད་ཀི་འདུག་འདྲ་བོ་ཡོད་བ་ ཨ་ནི་ ང་ཚོ་ངོ་ཚར་ཡ་ཡིན་རཱ་ཐ་ངོ་ཚར་ནས་བསྔད་བསྡད་ཡིན་ བར་སེང་གང་ཙང་པུས་མོ་བཙུགས་བཅུག་སོང་ད། ཨ་ནི་རྗེས་ལ་ཐ་ང་ཚོ་ཀིས་བཤད་ཡིན་པ་ད་རྒན་ལགས་ལ་ནོར་འཁྲུལ་ཨེ་འདྲས་རེད་ ,tha e 'dre byed ki 'dug 'dra bo yod ba _a ni _nga tsho ngo tshar ya yin rA tha ngo tshar nas bsngad bsdad yin _bar seng gang tsang pus mo btsugs bcug song da/_a ni rjes la tha nga tsho kis bshad yin pa da rgan lags la nor 'khrul e 'dras red _,https://d38pmlk0v88drf.cloudfront.net/wav16k/STT_NS0025_0143_1107410_to_1116272.wav,STT_NS,3,195,8.862,wav16k/STT_NS0025_0143_1107410_to_1116272.wav,ཨེ་འདྲའ་བྱེད་ཀི་འདུག་འདྲ་བོ་ཡོད་བ། ཨ་ལེ་ང་ཚོ་ངོ་ཚ་ཡ་ཡིན་རེད་བ། ད་ངོ་ཚ་ནས་བསྡད་བསྡད་ཡིན། བར་གསེང་གང་ཚང་པུས་མོ་བཙུགས་བཅུག་སོང་ད། ཨེ་ནས་རྗེས་ལ་ད་ང་ཚོ་གིས་བཤད་ཡིན་པ་ད་རྒན་ལགས་ལ་ནོར་འཁྲུལ་ཨེ་འདྲའི་འྲ་བོ།
STT_NS0025_0144_1116711_to_1121993,ང་ཚོ་ཚང་མ་ ག་ཟ་འདི་ དགེ་རྒན་ག་ཅི་ལས་ཤག་ནང་སྐད་བཏང་སོང་ དགེ་རྒན་ཚང་མ་མཉམ་དུ་འཛོམས་བསྡད་ཡོད་རེད་གདའ་ ,nga tsho tshang ma _ga za 'di _dge rgan ga ci las shag nang skad btang song _dge rgan tshang ma mnyam du 'dzoms bsdad yod red gda' _,https://d38pmlk0v88drf.cloudfront.net/wav16k/STT_NS0025_0144_1116711_to_1121993.wav,STT_NS,3,99,5.282,wav16k/STT_NS0025_0144_1116711_to_1121993.wav,ང་ཚོ་ཚང་མ་ཨ་ག་རེ་ཟ་དེ་དགེ་རྒན་ཀ་ཅི་ལས་ཤག་ནང་ལ་སྐད་བཏང་སོང་། དགེ་རྒན་ཚང་མ་མཉམ་དུ་འཛོམས་བསྡད་ཡོད་རེད་ད།
STT_NS0025_0145_1122212_to_1128675,དགེ་རྒན་ལས་བྱེད་གང་ཙང་ འཛིན་གྲྭ་སྤུ་གུ་གསུམ་བཅུ་སེ་ཡོད་རེད་ཚང་མ་འཛོམས་བསྡད་ཡོད་རེད་ ཡང་རྒན་ལགས་ངུ་ཡས་ཆད་ཡས་མིན་འདུག་ཡོད་བ།  ,dge rgan las byed gang tsang _'dzin grwa spu gu gsum bcu se yod red tshang ma 'dzoms bsdad yod red _yang rgan lags ngu yas chad yas min 'dug yod ba/__,https://d38pmlk0v88drf.cloudfront.net/wav16k/STT_NS0025_0145_1122212_to_1128675.wav,STT_NS,3,124,6.463,wav16k/STT_NS0025_0145_1122212_to_1128675.wav,དགེ་རྒན་སླེབས་པའི་རྗེས་ང་ཚོ་ནང་་འཛིན་གྲྭ་བུ་གུ་སུམ་ཅུ་སི་ཡོད་རེད། ཚང་མ་འཛོམས་བསྡད་ཡོད་རེད། ཡང་རྒན་ལགས་ རྒན་ལགས་ངུ་ཡ་བྱེད་ཡ་མི་འདུག་ཡོད་བ།
STT_NS0025_0156_1211186_to_1219812,རྒྱལ་ཡོངས་ཡིག་ཚད་བཏང་ ཇ་ཚགས་བརྒྱབ་དེ་ག་སི་ དེ་ནས་ལས་སོང་བ་ འཛིན་གྲྭ་དགུ་བ་ཐེངས་མ་གཉིས་བ་བསྡད་ ཨང་རྩིས་ཀྱིས་ལས་ ཐེངས་མ་གཉིས་བ་འདི་བསྡད་དུས་ཐ་གཞི་ནས་རོགས་པ་ཡག་པོ་ཐུག་ད་ལྟ་ཚེ་རྡོ་རྗེ་དང་ཨ་ནི་ཁྱོད།  ,rgyal yongs yig tshad btang _ja tshags brgyab de ga si _de nas las song ba _'dzin grwa dgu ba thengs ma gnyis ba bsdad _ang rtsis kyis las _thengs ma gnyis ba 'di bsdad dus tha gzhi nas rogs pa yag po thug da lta tshe rdo rje dang a ni khyod/__,https://d38pmlk0v88drf.cloudfront.net/wav16k/STT_NS0025_0156_1211186_to_1219812.wav,STT_NS,3,195,8.626,wav16k/STT_NS0025_0156_1211186_to_1219812.wav,རྒྱལ་ཡོངས་ཡིད་ཚད་ཏང་ཇ་ཚ་རྒྱབ་དུས་སྐབས་སུ་དེ་ནས་ལབ་སོང་བ།  འཛིན་གྲྭ་དགུ་པ་ཐེངས་མ་གཉིས་བསྡད། ཨང་རྩིས་ཀི་ལས། ཐེངས་མ་གཉིས་པ་དེ་བསྡད་དུས་ད་གཞི་ནས་རོགས་པ་ཡག་པོ་འདྲ་བོ་འདུག ད་ལྟ་ཚེ་རྡོ་རྗེ་དང་
